{
  "campaignId": "NVA-002",
  "thesis": "NOVAEL ARC turns ambient light into a sculptural focal point worth pausing for. The advertisement makes the crescent silhouette, the phrase LIGHT, HELD AS FORM., and a rising three-note arc inseparable in memory.",
  "productPriority": {
    "principle": "Recognize the complete lamp by 2.2 seconds, name NOVAEL ARC by 3.2 seconds, then move between whole-object, material and light-event views without losing geometry or confusing graphic expression with product behavior.",
    "heroHoldPolicy": "Movement earns attention, but every major motion resolves into a readable product state. The hook resolves to the complete arc, the light event resolves to a three-second hero state, and the final NOVAEL ARC lockup holds fully formed from 27.2 through 30.0 seconds.",
    "atmosphereLimit": "Charcoal, graphite, stone and amber remain the only world. Graphic arc light, tonal sweeps and parallax may organize the frame, but no invented beam, room extension, product control, fake orbit from still pixels or unsupported physical behavior is allowed."
  },
  "visualHierarchy": [
    "The continuous crescent silhouette and base, recognizable at 360x640",
    "The NOVAEL ARC name, introduced early and repeated on the close",
    "The frosted inner arc and controlled amber transformation",
    "The positioning line LIGHT, HELD AS FORM. and campaign line HOLD THE LIGHT.",
    "Stone, graphite texture and negative space as supporting material context"
  ],
  "sceneFamilies": [
    {
      "id": "arc-hook",
      "purpose": "Create immediate curiosity with a fast source-authentic macro-to-whole reveal and the first half of the visual and sonic mnemonic.",
      "allowedTechniques": ["Purpose-shot motion plate", "Rhythmic macro cuts", "Graphic arc-trace wipe aligned to the real diffuser curve", "Opening transient synchronized to first visible edge"],
      "avoid": ["Still-image opacity reveal", "Fake 3D orbit from a flattened source", "Unrecognizable darkness beyond 0.7 seconds", "Trailer impact grammar"]
    },
    {
      "id": "recognition-lock",
      "purpose": "Resolve motion into a whole product and bind the name NOVAEL ARC to the silhouette early.",
      "allowedTechniques": ["Short controlled push", "Kinetic two-stage name assembly", "Arc-shaped matte over a whole source", "Settled readable hold"],
      "avoid": ["Long static hold", "Product-crossing type", "Tiny wordmark", "Geometry-changing masks"]
    },
    {
      "id": "material-seduction",
      "purpose": "Make graphite, frosted material and curvature desirable through real or source-safe movement rather than technical explanation.",
      "allowedTechniques": ["Purpose-shot macro glide", "Source-safe traversal inside the authored detail plate", "Specular rhythm that already exists in source", "Tactile material accents"],
      "avoid": ["Invented seams", "Technical labels", "Synthetic sharpening", "Parallax between inseparable flattened surfaces"]
    },
    {
      "id": "light-event",
      "purpose": "Deliver the commercial peak: a genuine motion plate whose warm illumination increases globally and spatially coherently across the existing diffuser while a restrained exterior graphic arc supplies the directional mnemonic.",
      "allowedTechniques": ["Purpose-shot light transformation plate", "Slow push during actual plate motion", "Amber arc echo outside product geometry", "Synchronized tonal rise and arrival accent"],
      "avoid": ["Brightness tween presented as a product startup", "Emitter extraction from stills", "Neon bloom", "Unsupported performance implication"]
    },
    {
      "id": "controlled-release",
      "purpose": "Use brief stillness and negative space as contrast after the peak while residual motion and audio decay preserve continuity.",
      "allowedTechniques": ["Decelerating push", "One clean hard cut", "Residual arc echo", "Near-silence with audible room tone"],
      "avoid": ["Five-second freeze", "Immediate new climax", "Full audio dropout", "Unmotivated source change"]
    },
    {
      "id": "brand-memory",
      "purpose": "Repeat the proposition, land the complete product/name/campaign line, and resolve the three-note mnemonic without an outgoing fade.",
      "allowedTechniques": ["Whole-product hero motion plate", "Arc wipe into end card", "Editable name and campaign line", "Minimum 2.8-second complete lockup", "Final three-note mnemonic"],
      "avoid": ["Generic logo sting", "Copy appearing only at the last instant", "Fade to black", "New claims or CTA"]
    }
  ],
  "beatTreatments": [
    {
      "beatId": "S01",
      "sceneFamily": "arc-hook",
      "visualPriority": "A warm edge cuts through black, then a real macro move exposes enough of the crescent to create curiosity before the whole object is shown.",
      "cameraIntent": "Use ADD novael-arc-hook-sweep-v1.mp4: rapid 0.0-0.45 second macro acceleration along the inner curve, then decelerate toward a partial three-quarter silhouette by 1.5 seconds.",
      "typographyIntent": "No copy; the first frame must remain visually simple and legible on a phone.",
      "transitionIntent": "A thin graphic arc trace follows the real inner curve and becomes the wipe edge into S02; this is graphic expression, not emitted product light.",
      "audioIntent": "Start with a tactile stone click plus a 120 ms reverse-air pull, then state notes one and two of the three-note mnemonic as the edge and crescent appear.",
      "sourceTreatment": {"strategy": "Mandatory purpose-shot motion plate, classified ADD and currently unavailable. No still-based substitute is permitted for final production.", "allowMask": true, "allowSourceDerivedCleanup": false},
      "fallback": "If the plate is unavailable or geometry fails reference review, stop implementation with MISSING_MANDATORY_MOTION_SOURCE; a still zoom is not an acceptable fallback.",
      "riskNotes": ["The product must become readable by 1.5 seconds without revealing a different geometry.", "The arc matte must follow the visible diffuser and may not imply a controllable chase-light feature."]
    },
    {
      "beatId": "S02",
      "sceneFamily": "recognition-lock",
      "visualPriority": "The full lamp and base resolve immediately; NOVAEL ARC enters large in clean upper-left negative space and binds name to object.",
      "cameraIntent": "Rework shot-01-hero.png with a 2.5 percent push that settles by 2.7 seconds; keep base, tip and contact shadow continuously visible.",
      "typographyIntent": "NOVAEL arrives as one word at 1.75 seconds; ARC tracks along a short arc path and locks beside it by 2.25 seconds. Hold the complete name through 4.0 seconds.",
      "transitionIntent": "Complete the S01 arc wipe in the first 0.25 seconds, settle, then cut on a material tick into S03.",
      "audioIntent": "Land note three of the mnemonic at full-product recognition; a restrained tonal bed begins, with no low-frequency impact masking phone playback.",
      "sourceTreatment": {"strategy": "KEEP shot-01-hero.png intact as the recognition anchor; a campaign-specific curved matte may reveal the whole plate but must never isolate or deform the product.", "allowMask": true, "allowSourceDerivedCleanup": false},
      "fallback": "Use a direct cut to the intact hero and a shorter 1.5 percent push; preserve the early complete-name hold.",
      "riskNotes": ["The name must remain readable at 360x640.", "No crop may lose the arc tip or base."]
    },
    {
      "beatId": "S03",
      "sceneFamily": "material-seduction",
      "visualPriority": "Graphite texture, frosted diffuser and the shell junction move through frame with tactile clarity.",
      "cameraIntent": "Use ADD novael-arc-material-glide-v1.mp4 for a genuine 3.0-second lateral macro glide matching the canonical curvature; shot-02-detail.png remains the texture and framing reference.",
      "typographyIntent": "No copy; material motion and two precise sound accents carry the beat.",
      "transitionIntent": "Hard cut on the first material tick; end with a six-frame amber arc wipe that reveals S04.",
      "audioIntent": "Two quiet tactile accents, frosted-glass brush at 4.25 seconds and muted graphite tap at 5.65 seconds, articulate the glide over the tonal bed.",
      "sourceTreatment": {"strategy": "REWORK shot-02-detail.png as a reference and optional six-frame insert only; mandatory ADD motion plate is currently unavailable and must preserve exact shell thickness and diffuser path.", "allowMask": false, "allowSourceDerivedCleanup": false},
      "fallback": "If only the still remains, allow at most a 0.7-second source-safe traversal as an insert, then hold the design for missing motion rather than stretching it to fill three seconds.",
      "riskNotes": ["Macro generation can invent seams or change shell thickness.", "The motion plate must remain recognizable as the same lamp."]
    },
    {
      "beatId": "S04",
      "sceneFamily": "material-seduction",
      "visualPriority": "The whole arc returns as an editorial silhouette while the positioning line makes its emotional association explicit.",
      "cameraIntent": "Use shot-01-hero.png in a controlled 2 percent pull-back while a source-following arc window opens negative space; resolve by 9.5 seconds.",
      "typographyIntent": "Reveal LIGHT, HELD AS FORM. in three rhythmic groups: LIGHT, at 7.35; HELD AS at 8.05; FORM. at 8.75. All words are fully readable by 9.0 and remain fixed to 10.5.",
      "transitionIntent": "Enter under the amber arc wipe; use a two-frame luminance dip at 10.5 seconds to create anticipation without simulating a lamp power state.",
      "audioIntent": "Each copy group receives a soft harmonic pulse derived from the mnemonic pitches; the bed narrows and suspends before the hero event.",